{
  "schema_version": "temple.execution-policy/v1",
  "authority": {
    "default_selection_mode": "advisory",
    "supported_selection_modes": ["pinned", "shadow", "advisory"],
    "automatic_execution": false,
    "provider_contact": false,
    "mutation_performed": false
  },
  "capabilities": [
    { "id": "text.reasoning", "kind": "model", "description": "Analyze structured or natural-language inputs and produce text.", "modalities": ["text"] },
    { "id": "architecture.design", "kind": "method", "description": "Design technical boundaries, interfaces, and trade-offs.", "modalities": ["text"] },
    { "id": "code.change", "kind": "method", "description": "Create or modify repository implementation files.", "modalities": ["text"] },
    { "id": "documentation.author", "kind": "method", "description": "Create or reconcile human-facing project documentation.", "modalities": ["text"] },
    { "id": "quality.evaluate", "kind": "method", "description": "Evaluate an outcome against explicit acceptance evidence.", "modalities": ["text"] }
  ],
  "profiles": [
    { "id": "mechanical-fast", "model_class": "efficient", "reasoning_class": "light", "capabilities": ["text.reasoning", "code.change", "documentation.author"], "risk_classes": ["low"], "status": "active", "provider_id": null, "model": null, "reasoning_effort": null, "modalities": ["text"], "allowed_data_classes": ["public", "internal"], "execution_boundaries": ["local", "approved-provider"], "resource_estimates": [] },
    { "id": "lightweight-quality", "model_class": "efficient", "reasoning_class": "deep", "capabilities": ["text.reasoning", "code.change", "documentation.author", "quality.evaluate"], "risk_classes": ["low", "standard"], "status": "active", "provider_id": null, "model": null, "reasoning_effort": null, "modalities": ["text"], "allowed_data_classes": ["public", "internal"], "execution_boundaries": ["local", "approved-provider"], "resource_estimates": [] },
    { "id": "standard", "model_class": "balanced", "reasoning_class": "balanced", "capabilities": ["text.reasoning", "architecture.design", "code.change", "documentation.author", "quality.evaluate"], "risk_classes": ["low", "standard"], "status": "active", "provider_id": null, "model": null, "reasoning_effort": null, "modalities": ["text"], "allowed_data_classes": ["public", "internal"], "execution_boundaries": ["local", "approved-provider"], "resource_estimates": [] },
    { "id": "critical-planning", "model_class": "frontier", "reasoning_class": "deep", "capabilities": ["text.reasoning", "architecture.design", "code.change", "documentation.author", "quality.evaluate"], "risk_classes": ["low", "standard", "high", "critical"], "status": "active", "provider_id": null, "model": null, "reasoning_effort": null, "modalities": ["text"], "allowed_data_classes": ["public", "internal"], "execution_boundaries": ["local", "approved-provider"], "resource_estimates": [] }
  ],
  "rules": [
    { "id": "mechanical-low-risk", "match": { "task_kinds": ["mechanical"], "lifecycle_stages": ["*"], "risk_classes": ["low"] }, "preference_order": ["mechanical-fast", "lightweight-quality", "standard"] },
    { "id": "explicit-bounded-delivery", "match": { "task_kinds": ["bounded"], "lifecycle_stages": ["*"], "risk_classes": ["low", "standard"] }, "preference_order": ["standard", "lightweight-quality"] },
    { "id": "semantic-ambiguity-escalation", "match": { "task_kinds": ["semantic-ambiguity", "invariant-sensitive"], "lifecycle_stages": ["*"], "risk_classes": ["low", "standard"] }, "preference_order": ["lightweight-quality", "standard"] },
    { "id": "ordinary-delivery", "match": { "task_kinds": ["implementation", "diagnosis", "documentation"], "lifecycle_stages": ["*"], "risk_classes": ["low", "standard"] }, "preference_order": ["standard", "lightweight-quality"] },
    { "id": "consequential-work", "match": { "task_kinds": ["planning", "architecture", "security", "migration", "independent-qa"], "lifecycle_stages": ["*"], "risk_classes": ["high", "critical"] }, "preference_order": ["critical-planning"] }
  ],
  "fallback_profile_id": "standard",
  "resource_measures": [
    { "id": "tokens.total", "unit": "token", "aggregation": "sum" },
    { "id": "latency", "unit": "millisecond", "aggregation": "sum" },
    { "id": "retries", "unit": "count", "aggregation": "sum" },
    { "id": "credits", "unit": "credit", "aggregation": "sum" },
    { "id": "gpu.time", "unit": "second", "aggregation": "sum" },
    { "id": "image.count", "unit": "count", "aggregation": "sum" },
    { "id": "image.pixels", "unit": "pixel", "aggregation": "sum" },
    { "id": "video.duration", "unit": "second", "aggregation": "sum" },
    { "id": "audio.duration", "unit": "second", "aggregation": "sum" },
    { "id": "human.editing", "unit": "minute", "aggregation": "sum" }
  ]
}
